{
  "schema": "scopa.begin-request.v1",
  "sliceId": "request-id-logging",
  "outcome": "Add request-ID logging without changing the public API",
  "allowedPaths": [
    "src/**",
    "test/**"
  ],
  "gates": [
    {
      "id": "acceptance",
      "command": [
        "/usr/bin/true"
      ],
      "cwd": ".",
      "timeoutMs": 5000
    }
  ],
  "nonGoals": [
    "No dependency changes",
    "No deployment"
  ],
  "clientProfile": "generic"
}
